item_id,item_kind,label,paper_id,year,section,evidence,paraphrase
CSSA051.paper,paper,Simulations of state-of-the-art fermionic neural network wave functions with diffusion Monte Carlo,NQSC051,2021,title,[redacted_for_public_release],Paper node for the FermiNet* plus DMC study.
CSSA051.problem.efficiency_tuning,problem,Fermionic NQS still need efficiency and size tuning,NQSC051,2021,Related Work,[redacted_for_public_release],The paper identifies efficiency and network-size understanding as open issues.
CSSA051.method.ferminetstar,method,FermiNet* resource-reduced FermiNet implementation,NQSC051,2021,Fermi Net*,[redacted_for_public_release],FermiNet* alters the FermiNet implementation to reduce operation count and wall time.
CSSA051.method.dmc,method,Diffusion Monte Carlo applied after FermiNet* VMC optimization,NQSC051,2021,Diffusion Monte Carlo,[redacted_for_public_release],The study applies a simplified DMC implementation to FermiNet* trial wavefunctions.
CSSA051.benchmark.atoms,benchmark,Second-period atoms Be-Ne and carbon cation,NQSC051,2021,abstract,[redacted_for_public_release],The benchmark set covers atoms Be-Ne and C+.
CSSA051.limitation.autocorr_errorbars,limitation,DMC improves energy but can increase error bars through autocorrelation,NQSC051,2021,Results and Discussion,[redacted_for_public_release],The paper flags DMC autocorrelation and anomalous walker behavior as analysis risks.
NQSC069.paper,paper,Explicitly antisymmetrized neural network layers for variational Monte Carlo simulation,NQSC069,2021,title,[redacted_for_public_release],"Paper node for Lin, Goldshlager, and Lin on explicitly antisymmetrized layers in neural VMC."
NQSC069.benchmark.small_atoms_h4_n2,benchmark,"Small atoms, square H4, and stretched nitrogen molecule benchmark antisymmetric layers",NQSC069,2021,Numerical Experiments,[redacted_for_public_release],"The experiments compare architectures on atoms, square H4, and stretched N2."
NQSC069.limitation.factorial_sign_cancellation,limitation,Explicit antisymmetrization suffers factorial scaling and sign-cancellation instability,NQSC069,2021,Numerical stability and computational cost of the antisymmetric layer,[redacted_for_public_release],The explicit antisymmetry diagnostic cannot scale to large systems because of factorial cost and numerical instability.
NQSC071.paper,paper,Neural-Network Quantum States for Periodic Systems in Continuous Space,NQSC071,2021,title,[redacted_for_public_release],Paper node for Pescia et al. on periodic continuous-space NQS.
NQSC071.method.periodic_fourier_coordinates,method,Truncated periodic Fourier coordinate map for periodic boundary conditions,NQSC071,2021,Periodic Boundary Conditions (PBCs),[redacted_for_public_release],The ansatz periodizes particle coordinates using Fourier features and periodic distance surrogates.
NQSC071.benchmark.helium_gaussian_cores,benchmark,One- and two-dimensional Gaussian cores and one-dimensional helium benchmarks,NQSC071,2021,Results,[redacted_for_public_release],The paper evaluates the ansatz on periodic helium and Gaussian-core systems.
NQSC071.limitation.two_dimensional_dmc_gap,limitation,Two-dimensional Gaussian-core accuracy remains below DMC,NQSC071,2021,Influence of Network Architecture,[redacted_for_public_release],The authors state that widening the network alone does not close the 2D DMC gap.
NQSC106.paper,paper,Message-Passing Neural Quantum States for the Homogeneous Electron Gas,NQSC106,2023,title,[redacted_for_public_release],Paper node for Pescia et al. on MP-NQS for HEG.
NQSC106.method.mp_nqs_backflow,method,MP-NQS uses permutation-equivariant message passing to build many-body backflow coordinates,NQSC106,2023,Message-Passing Neural Quantum States,[redacted_for_public_release],The method parameterizes backflow coordinates with a permutation-equivariant MPNN.
NQSC106.regime.heg_density_system_size,regime,"Three-dimensional HEG across densities $r_s \\in [1,200]$ up to $N=128$ electrons",NQSC106,2023,Results,[redacted_for_public_release],The experiments cover polarized and unpolarized HEG across density and size regimes.
NQSC106.benchmark.nqs_dmc_heg,benchmark,"HEG benchmarks against FermiNet, WAPNet, BF-DMC, FN-DMC, FCI, and DCD",NQSC106,2023,Results,[redacted_for_public_release],The paper benchmarks MP-NQS against NQS and QMC/chemistry baselines.
NQSC120.paper,paper,Unifying view of fermionic neural network quantum states: From neural network backflow to hidden fermion determinant states,NQSC120,2023,title,[redacted_for_public_release],Paper node for Liu and Clark on NNBF/HFDS expressivity relations.
NQSC120.benchmark.hubbard_4x4,benchmark,4x4 periodic Hubbard model at $U/t=8$ and one-eighth hole doping,NQSC120,2023,Model and Wave Function Architecture,[redacted_for_public_release],The numerical comparison uses a periodic 4x4 Hubbard benchmark.
NQSC120.future.unifying_nqs_components,future_work,Unifying NQS components may lead to more accurate and scalable ansatzes,NQSC120,2023,Summary and Overview,[redacted_for_public_release],The paper frames component identification as a route to better NQS.
CSS045.paper,paper,Kinetic samplers for neural quantum states,NQSC045,2020,title,[redacted_for_public_release],"Paper node for Bagrov, Iliasov, and Westerhout on kinetic sampling for NQS."
CSS045.problem.autoregressive_symmetry_tradeoff,problem,Autoregressive exact sampling makes symmetry implementation problematic,NQSC045,2020,introduction,[redacted_for_public_release],The paper frames exact generative sampling as attractive but difficult to combine with broad lattice symmetries.
CSS045.benchmark.frustrated_spin_models,benchmark,J1-J2 square-lattice and kagome Heisenberg sampling benchmarks,NQSC045,2020,Benchmarks,[redacted_for_public_release],The paper benchmarks samplers on square-lattice J1-J2 and kagome Heisenberg ground-state distributions.
CSS045.future.tabu_symmetry_adaptation,future_work,Adapt Tabu/self-avoiding kinetic sampling to symmetry-adapted bases,NQSC045,2020,Conclusions,[redacted_for_public_release],The outlook identifies non-Markovian Tabu-style kinetic sampling with symmetries as future work.
CSS080.paper,paper,Hidden-nucleons neural-network quantum states for the nuclear many-body problem,NQSC080,2022,title,[redacted_for_public_release],"Paper node for Lovato, Adams, Carleo, and Rocco on hidden-nucleon NQS for nuclei."
CSS080.method.hidden_nucleon_ansatz,method,Hidden-nucleon determinant ansatz with fictitious nucleon degrees of freedom,NQSC080,2022,Hidden-nucleon wave function,[redacted_for_public_release],The ansatz augments visible nuclear coordinates with hidden nucleons whose coordinates are functions of the visible ones.
CSS080.limitation.nonphysical_metropolis_states,limitation,Hidden-nucleon ansatz can assign amplitude to nonphysical spin-isospin sectors,NQSC080,2022,Symmetries and sampling,[redacted_for_public_release],The paper notes that constrained Metropolis walks are required to avoid nonphysical isospin and spin-projection sectors.
CSS080.benchmark.light_and_oxygen_nuclei,benchmark,"H3, He3, He4, and O16 nuclear ground-state benchmarks",NQSC080,2022,Introduction,[redacted_for_public_release],The paper evaluates the ansatz on light nuclei and on oxygen-16 against HH and AFDMC references.
DTO013.paper,paper,Reconstructing quantum states with generative models,NQSC013,2018,title,[redacted_for_public_release],Paper node for Carrasquilla et al. generative-model tomography.
DTO013.method.ic_povm_distribution,method,Reduce tomography to learning informationally complete POVM statistics,NQSC013,2018,abstract,[redacted_for_public_release],The method turns tomography into unsupervised learning of IC measurement statistics.
DTO013.method.generative_model_distribution,method,Infer density matrices from expressive neural generative measurement distributions,NQSC013,2018,method,[redacted_for_public_release],The paper learns the IC outcome distribution with neural generative models and reconstructs states from it.
DTO013.benchmark.mpo_mps_states,benchmark,Matrix-product and GHZ-style tomography benchmarks,NQSC013,2018,numerical experiments,[redacted_for_public_release],The numerical section uses structured many-body states to test reconstruction quality.
DTO013.limitation.rbm_n4_training,limitation,RBM tomography becomes difficult beyond small systems,NQSC013,2018,numerical experiments,[redacted_for_public_release],The paper reports a practical RBM scaling difficulty that motivates the RNN switch.
DTO014.paper,paper,QuCumber: wavefunction reconstruction with neural networks,NQSC014,2018,title,[redacted_for_public_release],Paper node for the QuCumber RBM reconstruction package.
DTO014.method.qucumber_rbm_projective,method,QuCumber reconstructs wavefunctions with RBMs trained on projective measurements,NQSC014,2018,abstract,[redacted_for_public_release],QuCumber is presented as an RBM-based open-source reconstruction package.
DTO014.benchmark.tfim_critical_10,benchmark,Ten-spin transverse-field Ising model at criticality,NQSC014,2018,setup,[redacted_for_public_release],The paper uses a 10-spin TFIM critical-point reconstruction task.
DTO014.limitation.phase_rotations,limitation,Reference-basis measurements miss phases unless rotations are added,NQSC014,2018,complex wavefunctions,[redacted_for_public_release],Complex wavefunctions require additional rotated-basis data to learn phases.
DTO015.paper,paper,Neural-Network Approach to Dissipative Quantum Many-Body Dynamics,NQSC015,2019,title,[redacted_for_public_release],Paper node for Hartmann and Carleo neural density-matrix dynamics.
DTO015.method.rbm_density_matrix,method,Complex RBM density matrix is Hermitian and positive semidefinite,NQSC015,2019,method,[redacted_for_public_release],The paper uses a neural density-matrix parametrization with built-in physical structure.
DTO015.regime.k_local_efficiency,regime,Local Liouvillian evaluation remains efficient for k-local Hamiltonians,NQSC015,2019,supplement,[redacted_for_public_release],The supplement identifies k-local structure as an efficiency regime.
DTO015.limitation.strong_interactions,limitation,Stronger interactions require more parameters and samples,NQSC015,2019,results,[redacted_for_public_release],The paper reports increased resource demands in stronger-interaction regimes.
DTO019.paper,paper,Experimental neural network enhanced quantum tomography,NQSC019,2019,title,[redacted_for_public_release],Paper node for experimental neural-network-enhanced tomography.
DTO019.method.dnn_filter,method,Supervised DNN maps corrupted probabilities to ideal probabilities,NQSC019,2019,method,[redacted_for_public_release],The proposed network filters apparatus-specific SPAM corruption in measured probabilities.
DTO019.benchmark.six_dim_hg,benchmark,Six-dimensional Hermite-Gaussian photon modes with imperfect projective measurements,NQSC019,2019,experiment,[redacted_for_public_release],The experiment uses six-dimensional spatial photon modes and imperfect measurement apparatus.
DTO019.limitation.poor_projective_measurements,limitation,Poor projective measurements are a central experimental error source,NQSC019,2019,supplement,[redacted_for_public_release],The paper identifies imperfect projective measurements as a practical experimental limitation.
DTO031.paper,paper,Real time evolution with neural-network quantum states,NQSC031,2019,title,[redacted_for_public_release],Paper node for implicit-midpoint NNQS real-time evolution.
DTO031.benchmark.tf_ising_1d2d,benchmark,One-dimensional and two-dimensional transverse-field Ising dynamics benchmarks,NQSC031,2019,benchmarks,[redacted_for_public_release],The paper tests the method on 1D and 2D Ising time-evolution examples.
DTO031.limitation.critical_quenches,limitation,Critical quenches are the hardest tested dynamics regime,NQSC031,2019,2D benchmark,[redacted_for_public_release],The 2D benchmark identifies critical quenches as the most difficult regime.
DTO040.paper,paper,Quantum State Tomography with Conditional Generative Adversarial Networks,NQSC040,2020,title,[redacted_for_public_release],Paper node for QST-CGAN.
DTO040.method.cgan_density_layers,method,Conditional GAN outputs physical density matrices through custom layers,NQSC040,2020,abstract,[redacted_for_public_release],The generator architecture enforces physical density-matrix output.
DTO040.benchmark.optical_states_imle,benchmark,Optical-state tomography compared against iterative MLE,NQSC040,2020,benchmark,[redacted_for_public_release],The paper benchmarks CGAN tomography against iterative maximum-likelihood estimation.
DTO040.result.experiment_spam,result_claim,QST-CGAN reconstructs noisy Wigner-negative states despite SPAM,NQSC040,2020,experiment,[redacted_for_public_release],The experimental result shows reconstruction with substantially reduced data under SPAM noise.
DTO040.future.denoising_adaptive,future_work,Extend CGAN tomography toward denoising and adaptive tomography,NQSC040,2020,conclusion,[redacted_for_public_release],The conclusion proposes denoising and adaptive tomography extensions.
DTO041.paper,paper,Solving the Liouvillian Gap with Artificial Neural Networks,NQSC041,2020,title,[redacted_for_public_release],Paper node for RBM Liouvillian-gap estimation.
DTO041.method.spin_bibase_rbm,method,Map density/eigenmatrix problems to a spin bi-base and represent them with RBMs,NQSC041,2020,method,[redacted_for_public_release],The method combines a spin bi-base mapping with RBM representation.
DTO041.benchmark.dissipative_heisenberg,benchmark,One-dimensional and two-dimensional dissipative Heisenberg benchmarks,NQSC041,2020,abstract,[redacted_for_public_release],The paper benchmarks XYZ/XXZ dissipative spin models in one and two dimensions.
DTO041.limitation.xyz_slow,limitation,XYZ convergence is slower because of non-orthogonal decay modes,NQSC041,2020,supplement,[redacted_for_public_release],The supplement identifies a convergence bottleneck and resource remedy.
DTO099.paper,paper,Highly resolved spectral functions of two-dimensional systems with neural quantum states,NQSC099,2023,title,[redacted_for_public_release],Paper node for specNQS dynamical spectral functions.
DTO099.benchmark.qim_rydberg,benchmark,Quantum Ising and Rydberg-array dynamical structure factors,NQSC099,2023,contribution,[redacted_for_public_release],The benchmarks include QIM dynamics and Rydberg-array spectra.
DTO099.limitation.first_order_long_time,limitation,First-order transitions need exponentially long simulation time,NQSC099,2023,results,[redacted_for_public_release],The paper identifies a time-scale limitation near first-order dynamics.
DTO063.paper,paper,Pruning a restricted Boltzmann machine for quantum state reconstruction,NQSC063,2021,title,[redacted_for_public_release],Paper node for RBM tomography pruning.
DTO063.benchmark.tfim_pm_qcp,benchmark,TFIM paramagnetic and quantum-critical reconstruction regimes,NQSC063,2021,results,[redacted_for_public_release],The paper compares pruning behavior in paramagnetic and critical TFIM regimes.
DTO063.limitation.observable_degradation,limitation,Pruning can alter magnetization and correlations even when energy is stable,NQSC063,2021,order parameter,[redacted_for_public_release],The paper finds that physical observables can degrade differently under pruning.
DTO063.design_principle.monitor_observables,design_principle,Monitor multiple observables when compressing tomography models,NQSC063,2021,discussion,[redacted_for_public_release],The paper recommends tracking several observables because energy can hide degradation.
DTO077.paper,paper,Neural-network quantum state tomography,NQSC077,2022,title,[redacted_for_public_release],Paper node for feed-forward neural-network QST.
DTO077.benchmark.random_states_dim,benchmark,Random states in dimensions 3 5 7 and 9 with square-root measurements,NQSC077,2022,results,[redacted_for_public_release],The benchmarks test several finite-dimensional random-state reconstruction problems.
DTO077.limitation.li_bloch_nonphysical,limitation,Bloch and linear-inversion outputs do not guarantee positivity,NQSC077,2022,NN method,[redacted_for_public_release],The paper notes that some parametrizations can still fail physicality constraints.
DTO103.paper,paper,Neural-Shadow Quantum State Tomography,NQSC103,2023,title,[redacted_for_public_release],Paper node for NSQST.
DTO103.benchmark.qcd_afh_ghz,benchmark,QCD AFH and GHZ tomography examples,NQSC103,2023,noiseless examples,[redacted_for_public_release],The paper evaluates NSQST on several representative many-body states.
DTO103.limitation.postprocessing_noise_bias,limitation,Shadow training can require exponential postprocessing and noisy losses can be biased,NQSC103,2023,NSQST/noise,[redacted_for_public_release],The paper notes postprocessing and noise-bias limitations.
DTO110.paper,paper,Empirical Sample Complexity of Neural Network Mixed State Reconstruction,NQSC110,2023,title,[redacted_for_public_release],Paper node for mixed-state NQS reconstruction sample complexity.
DTO110.benchmark.finite_temp_tfim_lih,benchmark,Finite-temperature TFIM and depolarized LiH benchmarks,NQSC110,2023,simulations,[redacted_for_public_release],The benchmark suite includes thermal spin and noisy molecular states.
DTO110.evaluation.energy_infidelity_scaling,evaluation,Evaluate mixed-state reconstruction with energy and infidelity scaling exponents,NQSC110,2023,scaling,[redacted_for_public_release],The paper evaluates sample scaling through energy and infidelity-related reconstruction behavior across mixedness.
DTO110.limitation.nonconvex_optimization,limitation,Neural mixed-state reconstruction inherits nonconvex optimization difficulties,NQSC110,2023,introduction,[redacted_for_public_release],The introduction notes that compact NQS encodings bring optimization risks.
